{
  "artifacts": {
    "full": {
      "bytes": 20713760,
      "elf": {
        "buildIds": [
          "df5e4869383c150bbb3aab0ebac4eacb1dcd07d0"
        ],
        "executableLoad": {
          "bytes": 1096393,
          "segmentIndexes": [
            3
          ],
          "selector": "PT_LOAD with PF_X and nonzero p_filesz",
          "sha256": "0c2639a4c2e662205c79515424f1d4b28fb2d6602324ce10c0b575ca3d312499"
        },
        "header": {
          "abiVersion": 0,
          "class": "ELF64",
          "dataEncoding": "little-endian",
          "entryPoint": 4213344,
          "flags": 0,
          "headerSize": 64,
          "identVersion": 1,
          "machine": 62,
          "machineName": "EM_X86_64",
          "osAbi": 3,
          "osAbiName": "ELFOSABI_GNU",
          "programHeaderCount": 15,
          "programHeaderEntrySize": 56,
          "programHeaderOffset": 64,
          "sectionHeaderCount": 42,
          "sectionHeaderEntrySize": 64,
          "sectionHeaderOffset": 20711072,
          "sectionNameTableIndex": 41,
          "type": 2,
          "typeName": "ET_EXEC",
          "version": 1
        },
        "identity": {
          "abiVersion": 0,
          "class": "ELF64",
          "dataEncoding": "little-endian",
          "entryPoint": 4213344,
          "flags": 0,
          "identVersion": 1,
          "machine": 62,
          "osAbi": 3,
          "type": 2,
          "version": 1
        },
        "metadata": {
          "dwarfSections": [
            ".debug_abbrev",
            ".debug_aranges",
            ".debug_info",
            ".debug_line",
            ".debug_line_str",
            ".debug_loclists",
            ".debug_macro",
            ".debug_rnglists",
            ".debug_str"
          ],
          "dynamicSymbolTables": [
            {
              "entries": 165,
              "section": ".dynsym"
            }
          ],
          "hasDwarf": true,
          "hasDynamicSymbols": true,
          "hasStaticSymbols": true,
          "staticSymbolTables": [
            {
              "entries": 4764,
              "section": ".symtab"
            }
          ]
        },
        "programHeaders": [
          {
            "alignment": 8,
            "contentSha256": "b36941cd4b5998f54f2ea54e3737234fb96121cf965d53b946d90787c887a41c",
            "fileSize": 840,
            "flagNames": "R--",
            "flags": 4,
            "index": 0,
            "memorySize": 840,
            "offset": 64,
            "physicalAddress": 4194368,
            "type": 6,
            "typeName": "PT_PHDR",
            "virtualAddress": 4194368
          },
          {
            "alignment": 1,
            "contentSha256": "9097c98ea70f6f3b01d50145eb72bf55ad1f4e9713bccf27bd6405d6254eed00",
            "fileSize": 28,
            "flagNames": "R--",
            "flags": 4,
            "index": 1,
            "memorySize": 28,
            "offset": 972,
            "physicalAddress": 4195276,
            "type": 3,
            "typeName": "PT_INTERP",
            "virtualAddress": 4195276
          },
          {
            "alignment": 4096,
            "contentSha256": "be7ffcba85d0e5c0e5fb00097de50317533c9a06096a5442b1707e110f728e91",
            "fileSize": 11352,
            "flagNames": "R--",
            "flags": 4,
            "index": 2,
            "memorySize": 11352,
            "offset": 0,
            "physicalAddress": 4194304,
            "type": 1,
            "typeName": "PT_LOAD",
            "virtualAddress": 4194304
          },
          {
            "alignment": 4096,
            "contentSha256": "0c2639a4c2e662205c79515424f1d4b28fb2d6602324ce10c0b575ca3d312499",
            "fileSize": 1096393,
            "flagNames": "R-E",
            "flags": 5,
            "index": 3,
            "memorySize": 1096393,
            "offset": 12288,
            "physicalAddress": 4206592,
            "type": 1,
            "typeName": "PT_LOAD",
            "virtualAddress": 4206592
          },
          {
            "alignment": 4096,
            "contentSha256": "187fac459997caf597f264f28eef886b10d7bc1da4791bc9f5058449bb77cc4c",
            "fileSize": 1223192,
            "flagNames": "R--",
            "flags": 4,
            "index": 4,
            "memorySize": 1223192,
            "offset": 1110016,
            "physicalAddress": 5304320,
            "type": 1,
            "typeName": "PT_LOAD",
            "virtualAddress": 5304320
          },
          {
            "alignment": 4096,
            "contentSha256": "d03d9361eb976e7e42b264696860d17a93977cc28182b58bce7fb404200517af",
            "fileSize": 10128,
            "flagNames": "RW-",
            "flags": 6,
            "index": 5,
            "memorySize": 28104,
            "offset": 2336864,
            "physicalAddress": 6531168,
            "type": 1,
            "typeName": "PT_LOAD",
            "virtualAddress": 6531168
          },
          {
            "alignment": 8,
            "contentSha256": "d393cea305f097dd0d72a314ca358d895c826d7f6c4a932651b93169f55b7d1a",
            "fileSize": 496,
            "flagNames": "RW-",
            "flags": 6,
            "index": 6,
            "memorySize": 496,
            "offset": 2342344,
            "physicalAddress": 6536648,
            "type": 2,
            "typeName": "PT_DYNAMIC",
            "virtualAddress": 6536648
          },
          {
            "alignment": 8,
            "contentSha256": "5978480398fc48bfa6c56246117c5bc1a40145463a2faca541e5e91d5067ff79",
            "fileSize": 32,
            "flagNames": "R--",
            "flags": 4,
            "index": 7,
            "memorySize": 32,
            "offset": 904,
            "physicalAddress": 4195208,
            "type": 4,
            "typeName": "PT_NOTE",
            "virtualAddress": 4195208
          },
          {
            "alignment": 4,
            "contentSha256": "6f19d3baed3b4083b0b74c2bce64fac51ee1d9bbaf43faeec9072b8ecb955ef7",
            "fileSize": 36,
            "flagNames": "R--",
            "flags": 4,
            "index": 8,
            "memorySize": 36,
            "offset": 936,
            "physicalAddress": 4195240,
            "type": 4,
            "typeName": "PT_NOTE",
            "virtualAddress": 4195240
          },
          {
            "alignment": 4,
            "contentSha256": "6e48317ad93a8ac2dc04321465ede06d1274543fc8ab172e68171a9d684bb313",
            "fileSize": 32,
            "flagNames": "R--",
            "flags": 4,
            "index": 9,
            "memorySize": 32,
            "offset": 2333176,
            "physicalAddress": 6527480,
            "type": 4,
            "typeName": "PT_NOTE",
            "virtualAddress": 6527480
          },
          {
            "alignment": 8,
            "contentSha256": "e3b0c44298fc1c149afbf4c8996fb92427ae41e4649b934ca495991b7852b855",
            "fileSize": 0,
            "flagNames": "R--",
            "flags": 4,
            "index": 10,
            "memorySize": 16,
            "offset": 2336864,
            "physicalAddress": 6531168,
            "type": 7,
            "typeName": "PT_TLS",
            "virtualAddress": 6531168
          },
          {
            "alignment": 8,
            "contentSha256": "5978480398fc48bfa6c56246117c5bc1a40145463a2faca541e5e91d5067ff79",
            "fileSize": 32,
            "flagNames": "R--",
            "flags": 4,
            "index": 11,
            "memorySize": 32,
            "offset": 904,
            "physicalAddress": 4195208,
            "type": 1685382483,
            "typeName": "PT_GNU_PROPERTY",
            "virtualAddress": 4195208
          },
          {
            "alignment": 4,
            "contentSha256": "04a5aa1a0ee8023726ac2335bdaaf9d56126100dfd0a991e0f47ffb5d6ee35f7",
            "fileSize": 27364,
            "flagNames": "R--",
            "flags": 4,
            "index": 12,
            "memorySize": 27364,
            "offset": 2165672,
            "physicalAddress": 6359976,
            "type": 1685382480,
            "typeName": "PT_GNU_EH_FRAME",
            "virtualAddress": 6359976
          },
          {
            "alignment": 16,
            "contentSha256": "e3b0c44298fc1c149afbf4c8996fb92427ae41e4649b934ca495991b7852b855",
            "fileSize": 0,
            "flagNames": "RW-",
            "flags": 6,
            "index": 13,
            "memorySize": 0,
            "offset": 0,
            "physicalAddress": 0,
            "type": 1685382481,
            "typeName": "PT_GNU_STACK",
            "virtualAddress": 0
          },
          {
            "alignment": 1,
            "contentSha256": "2690d146390c1335a085e01f85e61a510d3974706af1cd5afade214a91bbdc59",
            "fileSize": 6048,
            "flagNames": "R--",
            "flags": 4,
            "index": 14,
            "memorySize": 6048,
            "offset": 2336864,
            "physicalAddress": 6531168,
            "type": 1685382482,
            "typeName": "PT_GNU_RELRO",
            "virtualAddress": 6531168
          }
        ],
        "sections": [
          {
            "address": 0,
            "alignment": 0,
            "allocated": false,
            "contentSha256": "e3b0c44298fc1c149afbf4c8996fb92427ae41e4649b934ca495991b7852b855",
            "entrySize": 0,
            "executable": false,
            "fileBacked": true,
            "flags": 0,
            "index": 0,
            "info": 0,
            "link": 0,
            "name": "",
            "offset": 0,
            "size": 0,
            "type": 0,
            "typeName": "SHT_NULL"
          },
          {
            "address": 4195208,
            "alignment": 8,
            "allocated": true,
            "contentSha256": "5978480398fc48bfa6c56246117c5bc1a40145463a2faca541e5e91d5067ff79",
            "entrySize": 0,
            "executable": false,
            "fileBacked": true,
            "flags": 2,
            "index": 1,